{
  "$schema": "http://json-schema.org/draft-07/schema#",
  "title": "Checkpoint",
  "description": "Pipeline checkpoint for interrupt/resume support. Written to <output_dir>/checkpoint.json after each stage completes.",
  "type": "object",
  "required": [
    "pipeline_id",
    "orchestrator",
    "user_prompt",
    "flags",
    "current_stage",
    "completed_stages",
    "stage_artifacts",
    "created_at",
    "updated_at"
  ],
  "properties": {
    "protocol_version": {
      "type": "string",
      "pattern": "^\\d+\\.\\d+$",
      "description": "Protocol version (major.minor), e.g. '1.0'."
    },
    "pipeline_id": {
      "type": "string",
      "pattern": "^[A-Za-z0-9](?:[A-Za-z0-9._-]{0,126}[A-Za-z0-9])?$",
      "maxLength": 128,
      "description": "Unique identifier for this pipeline run (UUID or timestamp-based)."
    },
    "orchestrator": {
      "type": "string",
      "enum": [
        "orchestrator-pipeline",
        "orchestrator-flow",
        "orchestrator-spec",
        "orchestrator-simple",
        "orchestrator-ci",
        "orchestrator-analysis",
        "orchestrator-modernize",
        "orchestrator-committee",
        "orchestrator-general",
        "orchestrator-ux"
      ],
      "description": "Which orchestrator is running this pipeline."
    },
    "user_prompt": {
      "type": "string",
      "minLength": 1,
      "description": "The original main_task_prompt provided by the user."
    },
    "flags": {
      "type": "object",
      "description": "All effective parsed and workflow-derived flag values for this run.",
      "properties": {
        "dry_run": { "type": "boolean", "default": false },
        "skip_tests": { "type": "boolean", "default": false },
        "test_only": { "type": "boolean", "default": false },
        "loose_review": { "type": "boolean", "default": false },
        "decision_only": { "type": "boolean", "default": false },
        "preset_mode": {
          "type": "string",
          "enum": ["balanced", "autonomous", "careful", "delivery", "interactive"]
        },
        "scout_mode": {
          "type": "string",
          "enum": ["auto", "skip", "force"],
          "default": "auto"
        },
        "budget_mode": {
          "type": "string",
          "enum": ["low", "medium", "high"]
        },
        "max_retry_rounds": { "type": "integer", "minimum": 0, "maximum": 5 },
        "review_mode": {
          "type": "string",
          "enum": ["auto", "off", "on"]
        },
        "review_reasoning_effort": {
          "type": "string",
          "enum": ["inherit", "max"],
          "default": "inherit"
        },
        "reasoning_mode": {
          "type": "string",
          "enum": ["inherit", "shadow", "adaptive"],
          "default": "adaptive"
        },
        "reasoning_policy_version": {
          "type": "string",
          "pattern": "^[A-Za-z0-9][A-Za-z0-9._-]{0,31}$",
          "maxLength": 32
        },
        "reasoning_ceiling": {
          "type": "string",
          "enum": ["medium", "high", "xhigh", "max"],
          "default": "max"
        },
        "allow_degraded_deep": {
          "type": "boolean",
          "default": false
        },
        "operational_retry_limit": {
          "type": "integer",
          "minimum": 0,
          "maximum": 2
        },
        "flow_recovery_limit": {
          "type": "integer",
          "minimum": 0,
          "maximum": 1
        },
        "flow_recovery_used": {
          "type": "integer",
          "minimum": 0,
          "maximum": 1
        },
        "handoff_mode": { "type": "boolean", "default": false },
        "kanban_mode": {
          "type": "string",
          "enum": ["off", "manual", "auto"]
        },
        "output_dir": { "type": "string" },
        "resume_mode": { "type": "boolean", "default": false },
        "confirm_mode": { "type": "boolean", "default": false },
        "verbose_mode": { "type": "boolean", "default": false },
        "iterate_mode": { "type": "boolean", "default": false },
        "generate_mode": { "type": "boolean", "default": false },
        "target_project_dir": { "type": "string" },
        "depth_mode": {
          "type": "string",
          "enum": ["lite", "standard", "deep"]
        },
        "modernize_mode": {
          "type": "string",
          "enum": ["plan", "plan+handoff", "phase-exec", "full-exec", "branch"]
        },
        "base_branch": { "type": "string" },
        "target_branch": { "type": "string" },
        "branch_created_before_artifacts": { "type": "boolean" },
        "execute_phase_id": { "type": "string" },
        "forwarded_pipeline_flags": {
          "type": "array",
          "items": { "type": "string" }
        }
      },
      "dependencies": {
        "reasoning_mode": ["reasoning_policy_version", "reasoning_ceiling"],
        "reasoning_policy_version": ["reasoning_mode", "reasoning_ceiling"],
        "reasoning_ceiling": ["reasoning_mode", "reasoning_policy_version"],
        "allow_degraded_deep": [
          "reasoning_mode",
          "reasoning_policy_version",
          "reasoning_ceiling"
        ]
      },
      "additionalProperties": true
    },
    "current_stage": {
      "type": "integer",
      "minimum": -1,
      "description": "The stage number that was most recently completed. -1 means pre-flight only."
    },
    "completed_stages": {
      "type": "array",
      "description": "Ordered list of completed stages.",
      "items": {
        "type": "object",
        "required": ["stage", "name", "status", "timestamp"],
        "properties": {
          "stage": {
            "type": "integer",
            "description": "Stage number."
          },
          "name": {
            "type": "string",
            "description": "Stage name (e.g. 'specifier', 'planner', 'repo-scout')."
          },
          "status": {
            "type": "string",
            "enum": ["completed", "skipped", "failed"],
            "description": "Outcome of this stage."
          },
          "artifact_key": {
            "type": "string",
            "description": "Key in stage_artifacts where this stage's output is stored."
          },
          "timestamp": {
            "type": "string",
            "format": "date-time",
            "description": "ISO 8601 timestamp when this stage completed."
          }
        }
      }
    },
    "stage_artifacts": {
      "type": "object",
      "description": "Map of artifact keys to their JSON outputs. Keys match artifact_key in completed_stages.",
      "additionalProperties": true
    },
    "created_at": {
      "type": "string",
      "format": "date-time",
      "description": "ISO 8601 timestamp when this checkpoint was first created."
    },
    "updated_at": {
      "type": "string",
      "format": "date-time",
      "description": "ISO 8601 timestamp when this checkpoint was last updated."
    }
  },
  "additionalProperties": false
}
